{"schema_version":"0.5.0","project":"owner/repository","mode":"brownfield","maturity":"SCOPE_BASELINE","baseline_revision":"scope-2026-08-27","items":[{"id":"WEB-001","platform":"web","module":"Identity","name":"Login","purpose":"Authenticate an existing user.","source_classification":"OBSERVED","implementation_status":"EXISTING","requirements":["FR-AUTH-001"],"roles":["guest"],"permissions":[],"data":[{"name":"credentials","source":"api","authoritative":true,"note":"Binding confirmed after API contract."}],"actions":[{"name":"Iniciar sesión","kind":"create","permission":null,"source_classification":"OBSERVED"}],"states":["default","loading","error","429"],"navigation":{"route":"/login","entry_points":[],"destinations":["WEB-004"]},"unresolved_api_needs":["Authoritative login operationId must be reconciled after API Gate."],"responsive":"Single-column on mobile; centered authentication container on larger screens.","accessibility":["Keyboard operable form","Programmatic error association"]},{"id":"WEB-004","platform":"web","module":"Operations","name":"Dashboard","purpose":"Summarize daily operational state.","source_classification":"OBSERVED","implementation_status":"PARTIAL","requirements":["FR-DASH-001"],"roles":["admin","coordinator"],"permissions":["dashboard.view","alerts.view"],"data":[{"name":"summary","source":"api","authoritative":true}],"actions":[{"name":"Open alerts","kind":"navigate","permission":"alerts.view","source_classification":"OBSERVED"}],"states":["default","loading","empty","error","offline","403"],"navigation":{"route":"/dashboard","entry_points":["WEB-001"],"destinations":[]},"unresolved_api_needs":["Dashboard summary operationId must be reconciled after API Gate."],"responsive":"Cards reflow from multi-column desktop to one-column mobile.","accessibility":["Logical heading hierarchy","Visible focus"]}]}
